{
  "suite_id": "forgeops-state-contract-v1",
  "suite_version": "1.0",
  "schema_ref": "contracts/forgeops-state-contract/1.0/schema.json",
  "cases": [
    {"id": "POSITIVE_CREATED_PENDING", "kind": "mapping", "snapshot": {"task_id": "TASK-STATE-1", "correlation_id": "CORR-STATE-1", "status": "PENDING", "revision": 0, "next_seq": 1}, "proposal": {"actor": "main", "product_state": "CREATED", "canonical_state": "PENDING", "base_revision": 0, "expected_seq": 1, "has_required_evidence": false}, "expected_result": "PASSED"},
    {"id": "POSITIVE_ACTIVE_IN_PROGRESS", "kind": "positive", "snapshot": {"task_id": "TASK-STATE-2", "correlation_id": "CORR-STATE-2", "status": "PENDING", "revision": 3, "next_seq": 4}, "proposal": {"actor": "main", "product_state": "TRIAGING", "canonical_state": "IN_PROGRESS", "base_revision": 3, "expected_seq": 4, "has_required_evidence": false}, "expected_result": "PASSED"},
    {"id": "POSITIVE_WAITING_FOR_HUMAN", "kind": "positive", "snapshot": {"task_id": "TASK-STATE-3", "correlation_id": "CORR-STATE-3", "status": "IN_PROGRESS", "revision": 4, "next_seq": 5}, "proposal": {"actor": "main", "product_state": "AWAITING_USER", "canonical_state": "WAITING_FOR_HUMAN", "base_revision": 4, "expected_seq": 5, "has_required_evidence": false}, "expected_result": "PASSED"},
    {"id": "POSITIVE_PARTIAL", "kind": "positive", "snapshot": {"task_id": "TASK-STATE-4", "correlation_id": "CORR-STATE-4", "status": "IN_PROGRESS", "revision": 5, "next_seq": 6}, "proposal": {"actor": "main", "product_state": "PARTIAL_RESULT", "canonical_state": "PARTIAL", "base_revision": 5, "expected_seq": 6, "has_required_evidence": false}, "expected_result": "PASSED"},
    {"id": "POSITIVE_VERIFIED_SUCCESS", "kind": "positive", "snapshot": {"task_id": "TASK-STATE-5", "correlation_id": "CORR-STATE-5", "status": "PARTIAL", "revision": 6, "next_seq": 7}, "proposal": {"actor": "main", "product_state": "COMPLETED_VERIFIED", "canonical_state": "SUCCEEDED", "base_revision": 6, "expected_seq": 7, "has_required_evidence": true}, "expected_result": "PASSED"},
    {"id": "POSITIVE_POLICY_BLOCK", "kind": "positive", "snapshot": {"task_id": "TASK-STATE-6", "correlation_id": "CORR-STATE-6", "status": "IN_PROGRESS", "revision": 7, "next_seq": 8}, "proposal": {"actor": "main", "product_state": "POLICY_BLOCKED", "canonical_state": "BLOCKED", "base_revision": 7, "expected_seq": 8, "has_required_evidence": false}, "expected_result": "PASSED"},
    {"id": "NEGATIVE_STALE_REVISION", "kind": "negative", "snapshot": {"task_id": "TASK-STATE-7", "correlation_id": "CORR-STATE-7", "status": "PENDING", "revision": 3, "next_seq": 9}, "proposal": {"actor": "main", "product_state": "TRIAGING", "canonical_state": "IN_PROGRESS", "base_revision": 2, "expected_seq": 9, "has_required_evidence": false}, "expected_error": "STATE_REVISION_STALE"},
    {"id": "NEGATIVE_SEQUENCE_REUSE", "kind": "negative", "snapshot": {"task_id": "TASK-STATE-8", "correlation_id": "CORR-STATE-8", "status": "PENDING", "revision": 3, "next_seq": 9}, "proposal": {"actor": "main", "product_state": "TRIAGING", "canonical_state": "IN_PROGRESS", "base_revision": 3, "expected_seq": 8, "has_required_evidence": false}, "expected_error": "STATE_SEQUENCE_OUT_OF_ORDER"},
    {"id": "NEGATIVE_SEQUENCE_SKIP", "kind": "negative", "snapshot": {"task_id": "TASK-STATE-9", "correlation_id": "CORR-STATE-9", "status": "PENDING", "revision": 3, "next_seq": 9}, "proposal": {"actor": "main", "product_state": "TRIAGING", "canonical_state": "IN_PROGRESS", "base_revision": 3, "expected_seq": 10, "has_required_evidence": false}, "expected_error": "STATE_SEQUENCE_OUT_OF_ORDER"},
    {"id": "NEGATIVE_NON_MAIN_ACTOR", "kind": "negative", "snapshot": {"task_id": "TASK-STATE-10", "correlation_id": "CORR-STATE-10", "status": "PENDING", "revision": 2, "next_seq": 3}, "proposal": {"actor": "work", "product_state": "TRIAGING", "canonical_state": "IN_PROGRESS", "base_revision": 2, "expected_seq": 3, "has_required_evidence": false}, "expected_error": "STATE_OWNER_INVALID"},
    {"id": "NEGATIVE_TERMINAL_RESTART", "kind": "negative", "snapshot": {"task_id": "TASK-STATE-11", "correlation_id": "CORR-STATE-11", "status": "SUCCEEDED", "revision": 2, "next_seq": 3}, "proposal": {"actor": "main", "product_state": "TRIAGING", "canonical_state": "IN_PROGRESS", "base_revision": 2, "expected_seq": 3, "has_required_evidence": false}, "expected_error": "STATE_TRANSITION_INVALID"},
    {"id": "NEGATIVE_SUCCESS_WITHOUT_EVIDENCE", "kind": "negative", "snapshot": {"task_id": "TASK-STATE-12", "correlation_id": "CORR-STATE-12", "status": "IN_PROGRESS", "revision": 2, "next_seq": 3}, "proposal": {"actor": "main", "product_state": "COMPLETED_VERIFIED", "canonical_state": "SUCCEEDED", "base_revision": 2, "expected_seq": 3, "has_required_evidence": false}, "expected_error": "STATE_EVIDENCE_INSUFFICIENT"},
    {"id": "NEGATIVE_MAPPING_INVALID", "kind": "negative", "snapshot": {"task_id": "TASK-STATE-13", "correlation_id": "CORR-STATE-13", "status": "IN_PROGRESS", "revision": 2, "next_seq": 3}, "proposal": {"actor": "main", "product_state": "TRIAGING", "canonical_state": "PARTIAL", "base_revision": 2, "expected_seq": 3, "has_required_evidence": false}, "expected_error": "STATE_MAPPING_INVALID"},
    {"id": "NEGATIVE_CANCELLED_COERCION", "kind": "negative", "snapshot": {"task_id": "TASK-STATE-14", "correlation_id": "CORR-STATE-14", "status": "IN_PROGRESS", "revision": 2, "next_seq": 3}, "proposal": {"actor": "main", "product_state": "CANCELLED", "canonical_state": "FAILED", "base_revision": 2, "expected_seq": 3, "has_required_evidence": false}, "expected_error": "STATE_CANCELLED_COERCION_FORBIDDEN"},
    {"id": "NEGATIVE_CANCELLED_COERCION_BLOCKED", "kind": "negative", "snapshot": {"task_id": "TASK-STATE-15", "correlation_id": "CORR-STATE-15", "status": "IN_PROGRESS", "revision": 2, "next_seq": 3}, "proposal": {"actor": "main", "product_state": "CANCELLED", "canonical_state": "BLOCKED", "base_revision": 2, "expected_seq": 3, "has_required_evidence": false}, "expected_error": "STATE_CANCELLED_COERCION_FORBIDDEN"}
  ]
}
